{
    "title": "Undertale",
    "description": "A videogame very famous made by TobbyFox",
    "creation": "2015-09-15",
    "tags": ["videogame","undertale"],
    "urls": ["https://en.wikipedia.org/wiki/Undertale","https://undertale.wiki/w/Undertale","https://steamdb.info/app/391540/info/"],
    "connect": []
}
