{
    "title": "タイニーリトル・アジアンタム",
    "description": "TODO Aaaaaannnnddddd.... Another example...",
    "creation": "2019-08-15",
    "tags": ["touhou", "music", "shibayan-records"],
    "urls": ["https://www.youtube.com/watch?v=rB7XFQgJHBI"],
    "connect": ["2008/pofv_yuka_kazamis_theme_gensokyo_past_and_present_flower_land"]
}
