{
    "title": "Stronger Than You - Chara Response (Undertale Animation Parody)",
    "description": "Song played during a battle, animation made by Clara Kraft (some one please add all the info)",
    "creation": "2016-07-26",
    "tags": ["music", "undertale"],
    "urls": ["https://www.youtube.com/watch?v=FGMRULiUMJo"],
    "connect": ["2015/stronger_than_you_sans_parody", "2015/undertale"]
}
