{
    "title": "Stronger Than You (Sans Parody)",
    "description": "Fan edit of Steven Universe that both songs played during a battle (some one please add all the info)",
    "creation": "2015-10-31",
    "tags": ["music", "undertale"],
    "urls": ["https://www.youtube.com/watch?v=GPBBo1neb2U"],
    "connect": ["2015/steven_universe_stronger_than_you", "2015/undertale"]
}
