{
    "title": "Steven Universe",
    "description": "A cartoon network series",
    "creation": "2013-11-04",
    "tags": ["steven-universe", "cartoon-network", "series"],
    "urls": ["https://steven-universe.fandom.com/es/wiki/Steven_Universe", "https://es.wikipedia.org/wiki/Steven_Universe", "https://www.imdb.com/es-es/title/tt3061046/"],
    "connect": []
}
