{
    "title": "Stronger than You - Chara response Remake (Undertale Animation Parody)",
    "description": "Remake of its own old animation",
    "creation": "2025-01-19",
    "tags": ["undertale", "music"],
    "urls": ["https://www.youtube.com/watch?v=qg9IMJKnIAA"],
    "connect": ["2016/stronger_than_you_chara_response_undertale_animation_parody", "2015/undertale"]
}
