{
    "title": "Steven Universe | Stronger Than You",
    "description": "Song played during a battle (some one please add all the info)",
    "creation": "2015-03-12",
    "tags": ["steven-universe", "music"],
    "urls": ["https://www.youtube.com/watch?v=7GrmiTlaVgo", "https://www.youtube.com/watch?v=F4AJfasBRxA", "https://steven-universe.fandom.com/wiki/Stronger_Than_You"],
    "connect": []
}
